{
  "$schema": "https://json-schema.org/draft/2020-12/schema",
  "$id": "urn:omniskill:schema:evidence:v1",
  "title": "OMNISKILL evidence report",
  "type": "object",
  "required": ["task", "mode", "status", "criteria"],
  "additionalProperties": false,
  "properties": {
    "task": {"type": "string", "minLength": 3},
    "mode": {"enum": ["QUICK", "PRO", "AUTONOMOUS", "AUDIT"]},
    "status": {"enum": ["VERIFIED", "PARTIAL", "BLOCKED", "UNVERIFIED"]},
    "criteria": {
      "type": "array",
      "minItems": 1,
      "items": {
        "type": "object",
        "required": ["id", "description", "essential", "status", "evidence"],
        "additionalProperties": false,
        "properties": {
          "id": {"type": "string", "minLength": 1},
          "description": {"type": "string", "minLength": 3},
          "essential": {"type": "boolean"},
          "status": {"enum": ["PASS", "FAIL", "NOT_VERIFIED"]},
          "evidence": {"type": "string"}
        }
      }
    },
    "actions": {
      "type": "array",
      "items": {
        "type": "object",
        "required": ["description", "state"],
        "additionalProperties": false,
        "properties": {
          "description": {"type": "string", "minLength": 3},
          "state": {"enum": ["planned", "attempted", "executed", "observed"]},
          "result": {"type": "string"}
        }
      }
    },
    "limitations": {"type": "array", "items": {"type": "string"}},
    "blockers": {"type": "array", "items": {"type": "string"}},
    "findings": {
      "type": "array",
      "items": {
        "type": "object",
        "required": ["id", "severity", "certainty", "location", "evidence"],
        "additionalProperties": false,
        "properties": {
          "id": {"type": "string"},
          "title": {"type": "string"},
          "severity": {"enum": ["CRITICAL", "HIGH", "MEDIUM", "LOW", "INFO"]},
          "certainty": {"enum": ["confirmed", "likely", "suspected"]},
          "location": {"type": "string", "minLength": 1},
          "evidence": {"type": "string", "minLength": 3},
          "fixed": {"type": "boolean"}
        }
      }
    }
  }
}
